{
  "@context": [
    "http://www.w3.org/ns/anno.jsonld",
    {
      "marq": "https://github.com/jimbarritt/marq/blob/main/doc/comments-design.md#"
    }
  ],
  "created": "2026-09-29T11:02:40Z",
  "creator": {
    "email": "mailto:jim@example.com",
    "name": "Jim",
    "type": "Person"
  },
  "id": "urn:uuid:68f1c007-e617-4d34-97a5-b3d7f4699686",
  "marq:annotation": "urn:uuid:98c1eb4e-e934-4674-b763-878fcb96a25f",
  "marq:state": "resolved",
  "type": "marq:StateChange"
}
